<?xml version="1.0" encoding="UTF-8"?>
<!DOCTYPE TIENDA SYSTEM "pinturas.dtd">
<TIENDA>
	<PROVEEDORES>
		<PROVEEDOR CIF="H47428157">
			<NOMBRE>Francisco Javier</NOMBRE>
			<APELLIDOS>Ruiz</APELLIDOS>
			<DOMICILIO>Platino 42</DOMICILIO>
		</PROVEEDOR>
		<PROVEEDOR CIF="J85967425">
			<NOMBRE>Frasco</NOMBRE>
			<APELLIDOS>García Pérez</APELLIDOS>
			<DOMICILIO>Al lado de mi casa</DOMICILIO>
			<TELEFONO>654321987</TELEFONO>
		</PROVEEDOR>
	</PROVEEDORES>
	<PEDIDOS>
		<PEDIDO  IDPROVEEDOR="H47428157">
			<PINTURA CANTIDAD="2 KILOS">
				<MARCA>Titanlux</MARCA>
				<COLOR>Verde</COLOR>
			</PINTURA>
		</PEDIDO>
		<PEDIDO IDPROVEEDOR="J85967425" FECHAHORA="17/01/2016-23:25">
			<PINTURA CANTIDAD="10 toneladas">
				<MARCA>Brugal</MARCA>
				<COLOR>Oro</COLOR>
			</PINTURA>
		</PEDIDO>
	</PEDIDOS>
</TIENDA>